{
  "id": "claude",
  "package_name": "relay-claude",
  "display_name": "Relay Claude",
  "description": "Thin native Claude Code execution surface that preserves explicit model, agent, and CLI parameters.",
  "short_description": "Run Claude Code with native controls",
  "default_prompt": "Use $relay-claude as a thin Claude Code execution layer. Preserve the user's explicit model, agent, and native parameters.",
  "mode": "single-backend",
  "default_backend": "claude",
  "allowed_backends": [
    "claude"
  ],
  "public_scripts": ["scripts/run_relay.ps1", "scripts/relay.ps1", "scripts/relay.cmd"],
  "public_assets": [],
  "package_root": "packages/relay-claude",
  "doc_entry": "docs/quickstart.md",
  "notes_backend": "claude"
}
