{
  "id": "agent",
  "package_name": "relay-agent",
  "display_name": "Relay",
  "description": "Thin multi-backend execution layer for Claude Code, OpenCode, and Antigravity that preserves native model and CLI controls.",
  "short_description": "Run a chosen native backend without wrapper policy",
  "default_prompt": "Use $relay-agent as a thin execution layer. Ask for an explicit backend, model, agent, and native parameters; preserve raw output for Codex review.",
  "mode": "router",
  "allowed_backends": [
    "claude",
    "opencode",
    "antigravity"
  ],
  "public_scripts": [
    "backends/agent/run_delegate_agent.ps1",
    "scripts/run_relay.ps1",
    "scripts/route_relay.ps1",
    "backends/agent/manage_auto_routing.ps1",
    "backends/agent/manage_auto_routing_nl.ps1",
    "backends/agent/AutoRoutingCommon.psm1"
  ],
  "public_assets": [
    {
      "source": "backends/agent/auto-routing.default.json",
      "target": "auto-routing.default.json"
    }
  ],
  "package_root": "packages/relay-agent",
  "doc_entry": "docs/routing-guide.md",
  "notes_backend": "agent"
}
