{
  "id": "opencode",
  "package_name": "relay-opencode",
  "display_name": "Relay OpenCode",
  "description": "Thin native OpenCode execution surface that preserves explicit model, agent, and CLI parameters.",
  "short_description": "Run OpenCode with native controls",
  "default_prompt": "Use $relay-opencode as a thin OpenCode execution layer. Preserve the user's explicit model, agent, and native parameters.",
  "mode": "single-backend",
  "default_backend": "opencode",
  "allowed_backends": [
    "opencode"
  ],
  "public_scripts": ["scripts/run_relay.ps1", "scripts/relay.ps1", "scripts/relay.cmd"],
  "public_assets": [],
  "package_root": "packages/relay-opencode",
  "doc_entry": "docs/quickstart.md",
  "notes_backend": "opencode"
}
