{
  "id": "opencode",
  "package_name": "relay-opencode",
  "display_name": "Relay OpenCode",
  "description": "Delegate coding implementation to OpenCode while Codex keeps responsibility for task decomposition, review, verification, retry prompts, and git commits.",
  "short_description": "Delegate coding work to OpenCode, then review",
  "default_prompt": "Use $relay-opencode to delegate this coding task to OpenCode, review the diff, and commit only verified changes.",
  "mode": "single-backend",
  "default_backend": "opencode",
  "allowed_backends": [
    "opencode"
  ],
  "public_scripts": [],
  "public_assets": [],
  "package_root": "packages/relay-opencode",
  "doc_entry": "docs/quickstart.md",
  "notes_backend": "opencode"
}
