{
  "id": "claude",
  "package_name": "codex-delegate-claude",
  "display_name": "Codex Delegate Claude",
  "description": "Delegate coding implementation to Claude Code while Codex keeps responsibility for task decomposition, review, verification, retry prompts, and git commits.",
  "short_description": "Delegate coding work to Claude, then review",
  "default_prompt": "Use $codex-delegate-claude to delegate this coding task to Claude Code, review the diff, and commit only verified changes.",
  "mode": "single-backend",
  "default_backend": "claude",
  "allowed_backends": [
    "claude"
  ],
  "public_scripts": [],
  "public_assets": [],
  "package_root": ".",
  "doc_entry": "docs/quickstart.md",
  "notes_backend": "claude"
}
