{
  "id": "antigravity",
  "package_name": "relay-antigravity",
  "display_name": "Relay Antigravity",
  "description": "Thin native Antigravity execution surface that preserves explicit model, agent, and CLI parameters.",
  "short_description": "Run Antigravity with native controls",
  "default_prompt": "Use $relay-antigravity as a thin Antigravity execution layer. Preserve the user's explicit model, agent, and native parameters.",
  "mode": "single-backend",
  "default_backend": "antigravity",
  "allowed_backends": [
    "antigravity"
  ],
  "public_scripts": ["scripts/run_relay.ps1", "scripts/relay.ps1", "scripts/relay.cmd"],
  "public_assets": [],
  "package_root": "packages/relay-antigravity",
  "doc_entry": "docs/Archive/quickstart.md",
  "notes_backend": "antigravity"
}
