{
  "id": "agent",
  "package_name": "codex-delegate-agent",
  "display_name": "Codex Delegate Agent",
  "description": "Unified delegation entrypoint that routes bounded coding tasks to Claude Code or OpenCode while Codex keeps responsibility for task decomposition, review, verification, retry prompts, and git commits.",
  "short_description": "Route coding work to Claude or OpenCode, then review",
  "default_prompt": "Use $codex-delegate-agent to choose the right backend, delegate this coding task, review the diff, and commit only verified changes.",
  "mode": "router",
  "allowed_backends": [
    "claude",
    "opencode",
    "antigravity"
  ],
  "public_scripts": [
    "backends/agent/run_delegate_agent.ps1",
    "backends/agent/manage_auto_routing.ps1",
    "backends/agent/manage_auto_routing_nl.ps1",
    "backends/agent/AutoRoutingCommon.psm1"
  ],
  "public_assets": [
    {
      "source": "backends/agent/auto-routing.default.json",
      "target": "auto-routing.default.json"
    }
  ],
  "package_root": "packages/codex-delegate-agent",
  "doc_entry": "docs/routing-guide.md",
  "notes_backend": "agent"
}
